"keyword","metadata_keyword_type","metadata_tool","metadata_description","metadata_tool_techniques","metadata_tool_tactics","metadata_malwares_name","metadata_groups_name","metadata_category","metadata_link","metadata_enable_endpoint_detection","metadata_enable_proxy_detection","metadata_comment","metadata_severity_score","metadata_popularity_score","metadata_github_stars","metadata_github_forks","metadata_github_updated_at","metadata_github_created_at"
"*%COMSPEC%*echo*\pipe\*","greyware_tool_keyword","echo","Detects the use of getsystem Meterpreter/Cobalt Strike command. Getsystem is used to elevate privilege to SYSTEM account.","T1068.003 - T1078.002","TA0004 - TA0008","N/A","N/A","Exploitation Tools","https://github.com/SigmaHQ/sigma/blob/master/rules/windows/process_creation/win_meterpreter_or_cobaltstrike_getsystem_service_start.yml","1","0","greyware tool - risks of False positive !","N/A","10","7082","2011","2023-12-02T14:45:29Z","2016-12-24T09:48:49Z"
"*cmd*echo*\pipe\*","greyware_tool_keyword","echo","Detects the use of getsystem Meterpreter/Cobalt Strike command. Getsystem is used to elevate privilege to SYSTEM account","T1068.003 - T1078.002","TA0004 - TA0008","N/A","N/A","Exploitation Tools","https://github.com/SigmaHQ/sigma/blob/master/rules/windows/process_creation/win_meterpreter_or_cobaltstrike_getsystem_service_start.yml","1","0","greyware tool - risks of False positive !","N/A","10","7082","2011","2023-12-02T14:45:29Z","2016-12-24T09:48:49Z"
"*cmd.exe  /S /D /c* echo 123","greyware_tool_keyword","echo","Adversaries may attempt to test echo command after exploitation","T1059.001 - T1059.003","TA0002 - TA0006","N/A","N/A","Defense Evasion","N/A","1","0","greyware tool - risks of False positive !","N/A","N/A","N/A","N/A","N/A","N/A"
"*cmd.exe /c echo %username%*","greyware_tool_keyword","echo","alternative to whoami","T1033","TA0007 ","N/A","N/A","Discovery","N/A","1","0","greyware tool - risks of False positive !","6","9","N/A","N/A","N/A","N/A"
"*cmd.exe /c echo * > \\.\pipe\*","greyware_tool_keyword","echo","Named pipe impersonation","T1134.002 - T1055 - T1548.002","TA0004 - TA0003 - TA0002","N/A","N/A","Privilege Escalation","https://thedfirreport.com/2023/04/03/malicious-iso-file-leads-to-domain-wide-ransomware/","1","0","N/A","7","10","N/A","N/A","N/A","N/A"
