"keyword","metadata_keyword_type","metadata_tool","metadata_description","metadata_tool_techniques","metadata_tool_tactics","metadata_malwares_name","metadata_groups_name","metadata_category","metadata_link","metadata_enable_endpoint_detection","metadata_enable_proxy_detection","metadata_comment","metadata_severity_score","metadata_popularity_score","metadata_github_stars","metadata_github_forks","metadata_github_updated_at","metadata_github_created_at"
"*/attackercan/*","offensive_tool_keyword","Github Username","github Penetration tester repo hosting malicious code","T1583 - T1595 - T1190","TA0001 - TA0002 - TA0008 - TA0011","N/A","N/A","Exploitation tools","https://github.com/attackercan/","1","1","N/A","N/A","N/A","N/A","N/A","N/A","N/A"
"*/Ben0xA/*","offensive_tool_keyword","Github Username","Github username of known powershell offensive modules and scripts","T1059 - T1027 - T1064 - T1086 - T1191 - T1202","TA0002 - TA0003 - TA0006 - TA0008 - TA0009 - TA0011","N/A","N/A","Exploitation tools","https://github.com/Ben0xA","1","1","N/A","N/A","N/A","N/A","N/A","N/A","N/A"
"*/Bo0oM*","offensive_tool_keyword","Github Username","Github username known for exploitation tools. Web application security researcher. Current Location: Moscow. Russia","N/A","N/A","N/A","N/A","Exploitation tools","https://github.com/Bo0oM","1","0","N/A","N/A","N/A","N/A","N/A","N/A","N/A"
"*/chrisk44/*","offensive_tool_keyword","Github Username","Github username known for network exploitation tools","N/A","N/A","N/A","N/A","Network Exploitation tools","https://github.com/chrisk44/Hijacker","1","1","N/A","N/A","10","2245","435","2020-08-26T19:01:31Z","2016-11-25T01:39:07Z"
"*/Cn33liz*","offensive_tool_keyword","Github Username","Github username Red teamer @ Outflank. Passionate about networking and cybersecurity.  known for exploitation tools dev","N/A","N/A","N/A","N/A","POST Exploitation tools","https://github.com/Cn33liz","1","1","N/A","N/A","N/A","N/A","N/A","N/A","N/A"
"*/Cneelis*","offensive_tool_keyword","Github Username","Github username Red teamer @ Outflank.Passionate about networking and cybersecurity. known for exploitation tools dev","N/A","N/A","N/A","N/A","POST Exploitation tools","https://twitter.com/Cneelis","1","0","N/A","N/A","N/A","N/A","N/A","N/A","N/A"
"*/Cybellum*","offensive_tool_keyword","Github Username","Zero day code injection and vulnerabilities github repo","N/A","N/A","N/A","N/A","Exploitation tools","https://github.com/Cybellum","1","0","N/A","N/A","N/A","N/A","N/A","N/A","N/A"
"*/CyDefUnicorn*","offensive_tool_keyword","Github Username","pentest tools repo","N/A","N/A","N/A","N/A","Exploitation tools","https://github.com/CyDefUnicorn","1","1","N/A","N/A","N/A","N/A","N/A","N/A","N/A"
"*/HarmJ0y*","offensive_tool_keyword","Github Username","Co-founder of Empire. BloodHound. and the Veil-Framework | PowerSploit developer | krb lover | Microsoft PowerShell MVP | Security at the misfortune of others","N/A","N/A","N/A","N/A","POST Exploitation tools","https://github.com/HarmJ0y","1","0","N/A","N/A","N/A","N/A","N/A","N/A","N/A"
"*/hlldz*","offensive_tool_keyword","Github Username","github username. 'My name is Halil Dalabasmaz. I consider myself Pwner.' containing exploitation tools","N/A","N/A","N/A","N/A","Exploitation tools","https://github.com/hlldz","1","0","N/A","N/A","N/A","N/A","N/A","N/A","N/A"
"*/m4ll0k/*","offensive_tool_keyword","Github Username","github username 'hacker' hosting exploitaitont tools and passwords attacks tools","N/A","N/A","N/A","N/A","Credential Access","https://github.com/m4ll0k","1","1","N/A","N/A","N/A","N/A","N/A","N/A","N/A"
"*/m8r0wn/*","offensive_tool_keyword","Github Username","pentester github username hosting exploitation tools","N/A","N/A","N/A","N/A","Exploitation tools","https://github.com/m8r0wn","1","1","N/A","N/A","N/A","N/A","N/A","N/A","N/A"
"*/trustedsec/*","offensive_tool_keyword","Github Username","github repo hosting various exploitation tools","N/A","N/A","N/A","N/A","Exploitation tools","https://github.com/trustedsec","1","0","N/A","N/A","N/A","N/A","N/A","N/A","N/A"
"*/x0rz/*","offensive_tool_keyword","Github Username","github repo username hosting exploitation tools","N/A","N/A","N/A","N/A","Exploitation tools","https://github.com/x0rz","1","0","N/A","N/A","N/A","N/A","N/A","N/A","N/A"
"*\cryptolok*","offensive_tool_keyword","Github Username","redteam tools github repo ","N/A","N/A","N/A","N/A","Exploitation tools","https://github.com/cryptolok","1","1","N/A","N/A","N/A","N/A","N/A","N/A","N/A"
"*aboul3la*","offensive_tool_keyword","Github Username","Github username of pentester known for enumeration tools","N/A","N/A","N/A","N/A","Information Gathering","https://github.com/aboul3la","1","0","N/A","N/A","N/A","N/A","N/A","N/A","N/A"
"*Amsi-Bypass*","offensive_tool_keyword","Github Username","This repo contains some Antimalware Scan Interface (AMSI) bypass / avoidance methods i found on different Blog Posts.","N/A","N/A","N/A","N/A","Exploitation tools","https://github.com/S3cur3Th1sSh1t/Amsi-Bypass-Powershell","1","1","N/A","N/A","10","1383","255","2023-03-01T17:09:02Z","2019-05-14T06:09:25Z"
"*BastilleResearch*","offensive_tool_keyword","Github Username","Open source testing tools for the SDR & security community","T1179 - T1141 - T1142 - T1143","TA0011 - ","N/A","N/A","Exploitation tools","https://github.com/BastilleResearch","1","1","N/A","N/A","N/A","N/A","N/A","N/A","N/A"
"*BC-SECURITY*","offensive_tool_keyword","Github Username","Cybersecurity Engineers and Offensive Security enthusiasts actively maintaining/updating Powershell Empire in our spare time.","T1021 - T1024 - T1027 - T1059 - T1074 - T1053","TA0008 - TA0003 - TA0006","N/A","N/A","Exploitation tools","https://github.com/BC-SECURITY","1","0","N/A","N/A","N/A","N/A","N/A","N/A","N/A"
"*berzerk0*","offensive_tool_keyword","Github Username","github username known for repos on passwords exploitation and offensive tools","N/A","N/A","N/A","N/A","Credential Access","https://github.com/berzerk0","1","0","N/A","N/A","N/A","N/A","N/A","N/A","N/A"
"*blackhat-arsenal-tools*","offensive_tool_keyword","Github Username","This github account maps to the Black Hat Arsenal tools since its inception in 2011. For readibility. the tools are classified by category and not by session.","N/A","N/A","N/A","N/A","Exploitation tools","https://github.com/toolswatch/blackhat-arsenal-tools","1","0","N/A","N/A","10","3601","1151","2023-10-11T11:20:59Z","2017-07-21T08:03:44Z"
"*byt3bl33d3r*","offensive_tool_keyword","Github Username","malware and offensive tools developper ","N/A","N/A","N/A","N/A","Exploitation tools","https://github.com/byt3bl33d3r","1","1","N/A","N/A","N/A","N/A","N/A","N/A","N/A"
"*Coalfire-Research*","offensive_tool_keyword","Github Username","Red team exploitation tools ","N/A","N/A","N/A","N/A","Exploitation tools","https://github.com/Coalfire-Research","1","0","N/A","N/A","N/A","N/A","N/A","N/A","N/A"
"*curi0usJack*","offensive_tool_keyword","Github Username","github user hosting malicious code and exploitation tools","N/A","N/A","N/A","N/A","Exploitation tools","https://github.com/curi0usJack","1","1","N/A","N/A","N/A","N/A","N/A","N/A","N/A"
"*D4Vinci*","offensive_tool_keyword","Github Username","Github user: A hacker. high&low-level coder and a lot of things between. An extremely curious creature loves to learn. Break things or make things that break things.","N/A","N/A","N/A","N/A","Exploitation tools","https://github.com/D4Vinci/","1","0","N/A","N/A","N/A","N/A","N/A","N/A","N/A"
"*danielbohannon*","offensive_tool_keyword","Github Username","Github user author of powershell obfuscation tools","N/A","N/A","N/A","N/A","Exploitation tools","https://github.com/danielbohannon","1","1","N/A","N/A","N/A","N/A","N/A","N/A","N/A"
"*dchrastil*","offensive_tool_keyword","Github Username","github user name hosting exploitation tools:hacker. scripting. recon. OSINT. automation","N/A","N/A","N/A","N/A","Exploitation tools","https://github.com/dchrastil","1","0","N/A","N/A","N/A","N/A","N/A","N/A","N/A"
"*deepzec*","offensive_tool_keyword","Github Username","Github Author of malicious scripts and eploitaiton tools ","N/A","N/A","N/A","N/A","Exploitation tools","https://github.com/deepzec","1","0","N/A","N/A","N/A","N/A","N/A","N/A","N/A"
"*DominicBreuker*","offensive_tool_keyword","Github Username","Github username hosting exploitation tools","N/A","N/A","N/A","N/A","Exploitation tools","https://github.com/DominicBreuker","1","0","N/A","N/A","N/A","N/A","N/A","N/A","N/A"
"*enigma0x3*","offensive_tool_keyword","Github Username","Github Author of malicious script and eploitaiton tools ","N/A","N/A","N/A","N/A","Exploitation tools","https://github.com/enigma0x3","1","1","N/A","N/A","N/A","N/A","N/A","N/A","N/A"
"*evilsocket*","offensive_tool_keyword","Github Username","github username of hacker known for sniffing and spoofing exploitation tools","N/A","N/A","N/A","N/A","Sniffing & Spoofing","https://github.com/evilsocket","1","0","N/A","N/A","N/A","N/A","N/A","N/A","N/A"
"*FortyNorthSecurity*","offensive_tool_keyword","Github Username","FortyNorth Security is a computer security consultancy specializing in offensive security work. We regularly perform red team assessments. pen tests. and more","N/A","N/A","N/A","N/A","Exploitation tools","https://github.com/FortyNorthSecurity","1","0","N/A","N/A","N/A","N/A","N/A","N/A","N/A"
"*g0tmi1k*","offensive_tool_keyword","Github Username","Github username hosting exploitation tools","N/A","N/A","N/A","N/A","Exploitation tools","https://github.com/g0tmi1k","1","0","N/A","N/A","N/A","N/A","N/A","N/A","N/A"
"*github.com/Arno0x*","offensive_tool_keyword","Github Username","Github username known for exploitation toos and scripts","N/A","N/A","N/A","N/A","Exploitation tools","https://github.com/Arno0x","1","1","N/A","N/A","N/A","N/A","N/A","N/A","N/A"
"*github.com/BishopFox*","offensive_tool_keyword","Github Username","Private professional services firm providing offensive security testing to the Fortune 500. serving exploitation tools on github","N/A","N/A","N/A","N/A","Exploitation tools","https://github.com/BishopFox","1","1","N/A","N/A","N/A","N/A","N/A","N/A","N/A"
"*github.com/dafthack*","offensive_tool_keyword","Github Username","Github user hosting exploitation tools for pentest and redteam","N/A","N/A","N/A","N/A","Exploitation tools","https://github.com/dafthack","1","1","N/A","N/A","N/A","N/A","N/A","N/A","N/A"
"*github.com/GoSecure*","offensive_tool_keyword","Github Username","github repo name containing multiple exploitation tools","N/A","N/A","N/A","N/A","Exploitation tools","https://github.com/GoSecure","1","1","N/A","N/A","N/A","N/A","N/A","N/A","N/A"
"*github.com/nccgroup*","offensive_tool_keyword","Github Username","github repo name hosting securty tools and exploitation tools","N/A","N/A","N/A","N/A","Exploitation tools","https://github.com/nccgroup","1","0","N/A","N/A","N/A","N/A","N/A","N/A","N/A"
"*github.com/quickbreach*","offensive_tool_keyword","Github Username","An infosec security researcher & penetration tester. hosting offensive tools","N/A","N/A","N/A","N/A","Sniffing & Spoofing","https://github.com/quickbreach","1","1","N/A","N/A","N/A","N/A","N/A","N/A","N/A"
"*github.com/sensepost*","offensive_tool_keyword","Github Username","github repo of orange cyberdefense red team","N/A","N/A","N/A","N/A","Exploitation tools","https://github.com/sensepost","1","1","N/A","N/A","N/A","N/A","N/A","N/A","N/A"
"*guardicore*monkey*","offensive_tool_keyword","Github Username","Welcome to the Infection Monkey! The Infection Monkey is an open source security tool for testing a data centers resiliency to perimeter breaches and internal server infection. The Monkey uses various methods to self propagate across a data center and reports success to a centralized Monkey Island server","T1566 - T1569 - T1570 - T1571 - T1572 - T1573","TA0007 - TA0008","N/A","N/A","Exploitation tools","https://github.com/h0nus","1","0","N/A","N/A","N/A","N/A","N/A","N/A","N/A"
"*Hack-with-Github*","offensive_tool_keyword","Github Username","An Open Source Hacking Tools database","N/A","N/A","N/A","N/A","Exploitation tools","https://github.com/Hack-with-Github","1","1","N/A","N/A","N/A","N/A","N/A","N/A","N/A"
"*Invoke-IR*","offensive_tool_keyword","Github Username","powershell forensic tools","N/A","N/A","N/A","N/A","Information Gathering","https://github.com/Invoke-IR","1","0","N/A","N/A","N/A","N/A","N/A","N/A","N/A"
"*itsKindred*","offensive_tool_keyword","Github Username","gthub username hosting malware samples and exploitation tools","N/A","N/A","N/A","N/A","Exploitation tools","https://github.com/itsKindred","1","0","N/A","N/A","N/A","N/A","N/A","N/A","N/A"
"*jedisct1*","offensive_tool_keyword","Github Username","github username. a knack for cryptography. computer vision. opensource software and infosec. hosting infosec tools used by pentester","N/A","N/A","N/A","N/A","Exploitation tools","https://github.com/jedisct1","1","0","N/A","N/A","N/A","N/A","N/A","N/A","N/A"
"*JPCERTCC*","offensive_tool_keyword","Github Username","github repo name containing multiple tools for log exploitation","N/A","N/A","N/A","N/A","Exploitation tools","https://github.com/JPCERTCC","1","0","N/A","N/A","N/A","N/A","N/A","N/A","N/A"
"*kernel-exploits*","offensive_tool_keyword","Github Username","github repo name hosting windows kernel exploits","N/A","N/A","N/A","N/A","Exploitation tools","https://github.com/SecWiki/windows-kernel-exploits","1","1","N/A","N/A","10","7594","2870","2021-06-11T23:29:15Z","2017-04-25T04:02:31Z"
"*kgretzky*","offensive_tool_keyword","Github Username","username Kuba Gretzky hosting sniffing and spoofing exploitation tools","N/A","N/A","N/A","N/A","Sniffing & Spoofing","https://github.com/kgretzky","1","0","N/A","N/A","N/A","N/A","N/A","N/A","N/A"
"*khast3x*","offensive_tool_keyword","Github Username","Red team exploitation tools ","N/A","N/A","N/A","N/A","Exploitation tools","https://github.com/khast3x","1","0","N/A","N/A","N/A","N/A","N/A","N/A","N/A"
"*klsecservices*","offensive_tool_keyword","Github Username","exploitation tools for attackers","N/A","N/A","N/A","N/A","Exploitation tools","https://github.com/klsecservices","1","0","N/A","N/A","N/A","N/A","N/A","N/A","N/A"
"*lanjelot*","offensive_tool_keyword","Github Username","github username. creator of patator and exploitation tools","N/A","N/A","N/A","N/A","Exploitation tools","https://github.com/lanjelot","1","0","N/A","N/A","N/A","N/A","N/A","N/A","N/A"
"*leapsecurity*","offensive_tool_keyword","Github Username","github repo name hosting exploitation tools","N/A","N/A","N/A","N/A","Exploitation tools","https://github.com/leapsecurity","1","0","N/A","N/A","N/A","N/A","N/A","N/A","N/A"
"*LordNoteworthy*","offensive_tool_keyword","Github Username","Github username of hacker known for malware pocs and  windows exploitations","N/A","N/A","N/A","N/A","Exploitation tools","https://github.com/LordNoteworthy","1","1","N/A","N/A","N/A","N/A","N/A","N/A","N/A"
"*matterpreter*","offensive_tool_keyword","Github Username","github username hosting offensive tools ","N/A","N/A","N/A","N/A","Exploitation tools","https://github.com/matterpreter","1","1","N/A","N/A","N/A","N/A","N/A","N/A","N/A"
"*mdsecactivebreach*","offensive_tool_keyword","Github Username","MDSecs ActiveBreach Team. own a github repo with lots of exploitation tools https://www.mdsec.co.uk/services/red-teaming/","N/A","N/A","N/A","N/A","Exploitation tools","https://github.com/mdsecactivebreach/","1","1","N/A","N/A","N/A","N/A","N/A","N/A","N/A"
"*mogwailabs*","offensive_tool_keyword","Github Username","MOGWAI LABS is an infosec boutique with a strong emphasis on offensive security github repo hosting offensive tools","N/A","N/A","N/A","N/A","Exploitation tools","https://github.com/mogwailabs","1","0","N/A","N/A","N/A","N/A","N/A","N/A","N/A"
"*MooseDojo*","offensive_tool_keyword","Github Username","github repo that was hosting exploitation tools. may be used by other exploitation tools ","N/A","N/A","N/A","N/A","Exploitation tools","https://github.com/MooseDojo","1","0","N/A","N/A","N/A","N/A","N/A","N/A","N/A"
"*Mr-Un1k0d3r*","offensive_tool_keyword","Github Username","github username Mostly Red Team tools for penetration testing. Twitter - @MrUn1k0d3r","N/A","N/A","N/A","N/A","Exploitation tools","https://github.com/Mr-Un1k0d3r","1","1","N/A","N/A","N/A","N/A","N/A","N/A","N/A"
"*mwrlabs*","offensive_tool_keyword","Github Username","used to be a malware repo aso hosting exploitation tools","N/A","N/A","N/A","N/A","Exploitation tools","https://github.com/mwrlabs","1","0","N/A","N/A","N/A","N/A","N/A","N/A","N/A"
"*n1nj4sec*","offensive_tool_keyword","Github Username","Github username hosting exploitation tools","N/A","N/A","N/A","N/A","Exploitation tools","https://github.com/n1nj4sec","1","1","N/A","N/A","N/A","N/A","N/A","N/A","N/A"
"*neoneggplant*","offensive_tool_keyword","Github Username","author of RAT tools on github","N/A","N/A","N/A","N/A","POST Exploitation tools","https://github.com/neoneggplant","1","0","N/A","N/A","N/A","N/A","N/A","N/A","N/A"
"*NextronSystems*","offensive_tool_keyword","Github Username","Author of APT simulator","N/A","N/A","N/A","N/A","Exploitation tools","https://github.com/NextronSystems","1","0","N/A","N/A","N/A","N/A","N/A","N/A","N/A"
"*nyxgeek*","offensive_tool_keyword","Github Username","github user hosting exploitation and recon tools","N/A","N/A","N/A","N/A","Information Gathering","https://github.com/nyxgeek","1","0","N/A","N/A","N/A","N/A","N/A","N/A","N/A"
"*obscuritylabs*","offensive_tool_keyword","Github Username","resources for pentesters","N/A","N/A","N/A","N/A","Exploitation tools","https://github.com/obscuritylabs","1","1","N/A","N/A","N/A","N/A","N/A","N/A","N/A"
"*P0cL4bs*","offensive_tool_keyword","Github Username","github repo name hosting lots of exploitation tools","N/A","N/A","N/A","N/A","Exploitation tools","https://github.com/P0cL4bs","1","1","N/A","N/A","N/A","N/A","N/A","N/A","N/A"
"*pentestmonkey*","offensive_tool_keyword","Github Username","github repo name - privileges exploitation and offensive tools","N/A","N/A","N/A","N/A","Exploitation tools","https://github.com/pentestmonkey","1","1","N/A","N/A","N/A","N/A","N/A","N/A","N/A"
"*r00t-3xp10it*","offensive_tool_keyword","Github Username","Pentest hosting multiple offensive tools","N/A","N/A","N/A","N/A","Exploitation tools","https://github.com/r00t-3xp10it","1","1","N/A","N/A","N/A","N/A","N/A","N/A","N/A"
"*rasta-mouse*","offensive_tool_keyword","Github Username","github user author of various offensive tools","N/A","N/A","N/A","N/A","Exploitation tools","https://github.com/rasta-mouse","1","1","N/A","N/A","N/A","N/A","N/A","N/A","N/A"
"*realgam3*","offensive_tool_keyword","Github Username","github user Security Researcher @F5Networks hosting reverse tools and other pentester tools for data exfiltration and password attacks","N/A","N/A","N/A","N/A","Exploitation tools","https://github.com/realgam3","1","1","N/A","N/A","N/A","N/A","N/A","N/A","N/A"
"*RedTeamOperations*","offensive_tool_keyword","Github Username","Red team exploitation tools ","N/A","N/A","N/A","N/A","Exploitation tools","https://github.com/RedTeamOperations","1","1","N/A","N/A","N/A","N/A","N/A","N/A","N/A"
"*s0lst1c3*","offensive_tool_keyword","Github Username","Github username hosting exploitation tools","N/A","N/A","N/A","N/A","Exploitation tools","https://github.com/s0lst1c3","1","1","N/A","N/A","N/A","N/A","N/A","N/A","N/A"
"*s0md3v*","offensive_tool_keyword","Github Username","github username hosting offensive tools. mostly for web hacking","N/A","N/A","N/A","N/A","Web Attacks","https://github.com/s0md3v","1","0","N/A","N/A","N/A","N/A","N/A","N/A","N/A"
"*S3cur3Th1sSh1t*","offensive_tool_keyword","Github Username","Github username of hackr known for exploitation scripts Pentesting. scripting and pwning!","N/A","N/A","N/A","N/A","Exploitation tools","https://github.com/S3cur3Th1sSh1t","1","1","N/A","N/A","N/A","N/A","N/A","N/A","N/A"
"*s7scan*","offensive_tool_keyword","Github Username","s7scan is a tool that scans networks. enumerates Siemens PLCs and gathers basic information about them. such as PLC firmware and hardwaare version. network configuration and security parameters. It is completely written on Python.","T1046 - T1018 - T1049 - T1040 - T1016 - T1057","TA0043 - TA0042 - TA0001","N/A","N/A","Exploitation tools","https://github.com/klsecservices/s7scan","1","1","N/A","N/A","2","124","45","2018-12-28T12:11:56Z","2018-10-12T08:52:04Z"
"*sailay1996*","offensive_tool_keyword","Github Username","github username hosting exploitation tools","N/A","N/A","N/A","N/A","Exploitation tools","https://github.com/sailay1996","1","0","N/A","N/A","N/A","N/A","N/A","N/A","N/A"
"*sc0tfree*","offensive_tool_keyword","Github Username","github username - Pentester. Red teamer. OSCP. Former wardialer and OKI 900 enthusiast. Senior Security Consultant @ctxis hosting offensve tools","N/A","N/A","N/A","N/A","Exploitation tools","https://github.com/sc0tfree","1","0","N/A","N/A","N/A","N/A","N/A","N/A","N/A"
"*Screetsec*","offensive_tool_keyword","Github Username","github username hosting post exploitation tools","N/A","N/A","N/A","N/A","POST Exploitation tools","https://github.com/Screetsec","1","0","N/A","N/A","N/A","N/A","N/A","N/A","N/A"
"*secgroundzero*","offensive_tool_keyword","Github Username","github username hosting  exploitation tools","N/A","N/A","N/A","N/A","Exploitation tools","https://github.com/secgroundzero","1","1","N/A","N/A","N/A","N/A","N/A","N/A","N/A"
"*secrary*","offensive_tool_keyword","Github Username","github username hosting process injection codes ","N/A","N/A","N/A","N/A","Exploitation tools","https://github.com/secrary","1","0","N/A","N/A","N/A","N/A","N/A","N/A","N/A"
"*securitywithoutborders*","offensive_tool_keyword","Github Username","pentest documentations","N/A","N/A","N/A","N/A","Information Gathering","https://github.com/securitywithoutborders","1","0","N/A","N/A","N/A","N/A","N/A","N/A","N/A"
"*SilverPoision*","offensive_tool_keyword","Github Username","Github username hosting exploitation tools","N/A","N/A","N/A","N/A","Exploitation tools","https://github.com/SilverPoision","1","0","N/A","N/A","N/A","N/A","N/A","N/A","N/A"
"*SySS-Research*","offensive_tool_keyword","Github Username","github repo Open source IT security software tools and information and exploitation tools","N/A","N/A","N/A","N/A","Exploitation tools","https://github.com/SySS-Research","1","1","N/A","N/A","N/A","N/A","N/A","N/A","N/A"
"*threatexpress*","offensive_tool_keyword","Github Username","github repo hosting post exploitation tools","N/A","N/A","N/A","N/A","POST Exploitation tools","https://github.com/threatexpress","1","0","N/A","N/A","N/A","N/A","N/A","N/A","N/A"
"*tiagorlampert*","offensive_tool_keyword","Github Username","github repo username hosting exploitation tools","N/A","N/A","N/A","N/A","Exploitation tools","https://github.com/tiagorlampert","1","0","N/A","N/A","N/A","N/A","N/A","N/A","N/A"
"*True-Demon*","offensive_tool_keyword","Github Username","github repo hosting offensive tools and exploitation frameworks","N/A","N/A","N/A","N/A","Exploitation tools","https://github.com/True-Demon","1","0","N/A","N/A","N/A","N/A","N/A","N/A","N/A"
"*TryCatchHCF*","offensive_tool_keyword","Github Username","github repo hosting sniffing spoofing and data exfiltration tools","N/A","N/A","N/A","N/A","Data Exfiltration","https://github.com/TryCatchHCF","1","0","N/A","N/A","N/A","N/A","N/A","N/A","N/A"
"*Und3rf10w*","offensive_tool_keyword","Github Username","github repo hosting offensive tools and exploitation frameworks","N/A","N/A","N/A","N/A","POST Exploitation tools","https://github.com/Und3rf10w","1","1","N/A","N/A","N/A","N/A","N/A","N/A","N/A"
"*unixpickle*","offensive_tool_keyword","Github Username","github repo hosting obfuscation tools","N/A","N/A","N/A","N/A","Defense Evasion","https://github.com/unixpickle","1","0","N/A","N/A","N/A","N/A","N/A","N/A","N/A"
"*virajkulkarni14*","offensive_tool_keyword","Github Username","github repo username hosting exploitation tools","N/A","N/A","N/A","N/A","Exploitation tools","https://github.com/virajkulkarni14","1","0","N/A","N/A","N/A","N/A","N/A","N/A","N/A"
"*Viralmaniar*","offensive_tool_keyword","Github Username","github username hosting post exploitation tools and recon tools","N/A","N/A","N/A","N/A","POST Exploitation tools","https://github.com/Viralmaniar","1","0","N/A","N/A","N/A","N/A","N/A","N/A","N/A"
"*vysecurity*","offensive_tool_keyword","Github Username","github username hosting red team tools","N/A","N/A","N/A","N/A","Exploitation tools","https://github.com/vysecurity","1","0","N/A","N/A","N/A","N/A","N/A","N/A","N/A"
"*x90skysn3k*","offensive_tool_keyword","Github Username","Github username known for password exploitation and offensive tools","N/A","N/A","N/A","N/A","Exploitation tools","https://github.com/x90skysn3k","1","1","N/A","N/A","N/A","N/A","N/A","N/A","N/A"
"*xillwillx*","offensive_tool_keyword","Github Username","github repo username hosting red team tools","N/A","N/A","N/A","N/A","Exploitation tools","https://github.com/xillwillx","1","0","N/A","N/A","N/A","N/A","N/A","N/A","N/A"
"*xoreaxeaxeax*","offensive_tool_keyword","Github Username","github username hosting obfuscation and exploitation tools","N/A","N/A","N/A","N/A","Exploitation tools","https://github.com/xoreaxeaxeax","1","0","N/A","N/A","N/A","N/A","N/A","N/A","N/A"
